{
  "protocol": {
    "version": "1.0",
    "request_id": "22222222-2222-4222-8222-222222222221",
    "timestamp": "2026-08-02T14:00:00+00:00",
    "nonce": "AAAAAAAAAAAAAAAAAAAAAAAAAAAAAAAA"
  },
  "client": {
    "name": "zithis/licence-client",
    "version": "1.0.0",
    "supported_protocol_versions": [
      "1.0"
    ]
  },
  "product": {
    "code": "zithis",
    "package_identifier": "zithis/zithis.php",
    "installed_version": "1.1.27"
  },
  "installation": {
    "id": "11111111-1111-4111-8111-111111111111",
    "scope": "customer.example",
    "environment": "production",
    "canonical_uri": "https://customer.example"
  },
  "operation": {
    "name": "activate",
    "parameters": {
      "licence_key": "ZITHIS-TEST-KEY-0001"
    }
  }
}
